{
  "$schema": "http://json-schema.org/draft-07/schema#",
  "$id": "https://hotkys.com/schema/shortcut.schema.json",
  "title": "Application shortcuts",
  "description": "Keyboard shortcuts for one application",
  "type": "object",
  "properties": {
    "$schema": {
      "description": "Schema reference",
      "type": "string",
      "enum": [
        "schema/shortcut.schema.json",
        "https://hotkys.com/schema/shortcut.schema.json"
      ]
    },
    "bundleId": {
      "description": "Bundle id is a unique identifier for the macOS application. Example: 'com.microsoft.VSCode'",
      "type": "string",
      "minLength": 1,
      "maxLength": 255
    },
    "hostname": {
      "description": "Hostname of the web application. Supports wildcard prefix for subdomains. Examples: 'code.visualstudio.com', '*.zendesk.com'",
      "type": "string",
      "minLength": 1,
      "maxLength": 253
    },
    "windowsAppId": {
      "description": "Application identifier returned by Raycast on Windows (may be an AppUserModelID; not an executable name)",
      "type": "string",
      "minLength": 1,
      "maxLength": 255
    },
    "slug": {
      "description": "Unique readable identifier",
      "type": "string",
      "minLength": 1,
      "maxLength": 80,
      "pattern": "^[a-zA-Z0-9]+(?:-[a-zA-Z0-9]+)*$"
    },
    "name": {
      "description": "Name of the application",
      "type": "string",
      "minLength": 1,
      "maxLength": 100
    },
    "source": {
      "description": "Link to the source of the shortcuts",
      "type": "string",
      "format": "uri",
      "pattern": "^(?!.*[\\u0000-\\u001F\\u007F])[Hh][Tt][Tt][Pp][Ss]?://(?:[a-zA-Z0-9](?:[a-zA-Z0-9-]{0,61}[a-zA-Z0-9])?\\.)*[a-zA-Z0-9](?:[a-zA-Z0-9-]{0,61}[a-zA-Z0-9])?(?::(?:0|[1-9][0-9]{0,3}|[1-5][0-9]{4}|6[0-4][0-9]{3}|65[0-4][0-9]{2}|655[0-2][0-9]|6553[0-5]))?(?:[/?#]|$)",
      "maxLength": 2048
    },
    "icon": {
      "description": "Path to the application icon. Can be a relative path (e.g., 'icons/app.png') or an absolute URL",
      "type": "string",
      "minLength": 1,
      "maxLength": 2048,
      "anyOf": [
        {
          "format": "uri",
          "pattern": "^(?!.*[\\u0000-\\u001F\\u007F])[Hh][Tt][Tt][Pp][Ss]?://(?:[a-zA-Z0-9](?:[a-zA-Z0-9-]{0,61}[a-zA-Z0-9])?\\.)*[a-zA-Z0-9](?:[a-zA-Z0-9-]{0,61}[a-zA-Z0-9])?(?::(?:0|[1-9][0-9]{0,3}|[1-5][0-9]{4}|6[0-4][0-9]{3}|65[0-4][0-9]{2}|655[0-2][0-9]|6553[0-5]))?(?:[/?#]|$)"
        },
        {
          "pattern": "^(?!.*[\\u0000-\\u001F\\u007F])(?![a-zA-Z][a-zA-Z0-9+.-]*:)(?![/\\\\]{2})(?!\\\\).+"
        }
      ]
    },
    "keymaps": {
      "description": "List of the application keymaps. Most of the applications have single keymap that should be named 'Default'.",
      "type": "array",
      "items": {
        "$ref": "#/$defs/keymap"
      },
      "minItems": 1,
      "maxItems": 100
    },
    "windowsProcessName": {
      "description": "Executable filename without .exe, used to locate an open desktop window on Windows",
      "type": "string",
      "minLength": 1,
      "maxLength": 100,
      "pattern": "^[A-Za-z0-9][A-Za-z0-9 ._-]*$"
    }
  },
  "required": [
    "$schema",
    "name",
    "slug",
    "keymaps"
  ],
  "additionalProperties": false,
  "$defs": {
    "keymap": {
      "description": "Application keymap. Keymap is a shortcut configuration.",
      "type": "object",
      "properties": {
        "title": {
          "description": "Keymap title",
          "type": "string",
          "minLength": 1,
          "maxLength": 100
        },
        "platforms": {
          "description": "Platforms for which this keymap is designed",
          "type": "array",
          "items": {
            "type": "string",
            "enum": [
              "windows",
              "linux",
              "macos"
            ]
          },
          "minItems": 1,
          "uniqueItems": true
        },
        "sections": {
          "description": "List of sections",
          "type": "array",
          "items": {
            "$ref": "#/$defs/section"
          },
          "minItems": 1,
          "maxItems": 500
        }
      },
      "required": [
        "title",
        "sections"
      ],
      "additionalProperties": false
    },
    "section": {
      "description": "Section with shortcuts or category. Examples: Edit, Navigate, Format.",
      "type": "object",
      "properties": {
        "title": {
          "description": "Section title",
          "type": "string",
          "minLength": 1,
          "maxLength": 100
        },
        "shortcuts": {
          "description": "List of shortcuts",
          "type": "array",
          "items": {
            "$ref": "#/$defs/section-shortcut"
          },
          "minItems": 1,
          "maxItems": 2000
        }
      },
      "required": [
        "title",
        "shortcuts"
      ],
      "additionalProperties": false
    },
    "section-shortcut": {
      "description": "Shortcut with a title and a key and/or comment",
      "type": "object",
      "properties": {
        "title": {
          "description": "Shortcut title",
          "type": "string",
          "minLength": 1,
          "maxLength": 50
        },
        "key": {
          "description": "Shortcut key definition. Key consist of modifiers plus base key separated by '+' sign. Supported modifiers: 'ctrl', 'shift', 'opt', 'cmd', 'win'. Modifiers should be specified in that exact order, lowercase. Final shortcut token should always be a base key. Examples: 'ctrl+s', 'shift+cmd+e', 'win+e'. Shortcut macro or sequences of shortcuts are also supported and should be separated by whitespace (' '). Example: 'cmd+k cmd+s'",
          "type": "string",
          "minLength": 1,
          "maxLength": 255
        },
        "comment": {
          "description": "Text comment for the shortcut. Can be used as a substitute or addition to the declared key",
          "type": "string",
          "minLength": 1,
          "maxLength": 50
        }
      },
      "required": [
        "title"
      ],
      "anyOf": [
        {
          "required": [
            "key"
          ]
        },
        {
          "required": [
            "comment"
          ]
        }
      ],
      "additionalProperties": false
    }
  }
}
