{
  "$schema": "schema/shortcut.schema.json",
  "bundleId": "com.jetbrains.intellij",
  "name": "IntelliJ IDEA",
  "slug": "intellij-idea",
  "icon": "icons/intellij-idea.png",
  "keymaps": [
    {
      "title": "Default",
      "platforms": [
        "macos"
      ],
      "sections": [
        {
          "title": "Popular",
          "shortcuts": [
            {
              "title": "Search everywhere",
              "key": "shift shift"
            },
            {
              "title": "Find action...",
              "key": "shift+cmd+a"
            },
            {
              "title": "Show Project window",
              "key": "cmd+1"
            },
            {
              "title": "Rebuild",
              "key": "shift+cmd+f9"
            },
            {
              "title": "Show Intention Actions",
              "key": "opt+enter"
            },
            {
              "title": "Recent files",
              "key": "cmd+e"
            },
            {
              "title": "Find usages",
              "key": "opt+f7"
            },
            {
              "title": "Select in...",
              "key": "opt+f1"
            },
            {
              "title": "Settings",
              "key": "cmd+,"
            },
            {
              "title": "Generate",
              "key": "cmd+n"
            },
            {
              "title": "Run anything",
              "key": "ctrl ctrl"
            },
            {
              "title": "Debug",
              "key": "ctrl+opt+d"
            },
            {
              "title": "View breakpoints",
              "key": "shift+cmd+f8"
            },
            {
              "title": "Attach to process",
              "key": "shift+opt+f5"
            },
            {
              "title": "VCS operations popup",
              "key": "ctrl+v"
            },
            {
              "title": "Refactor this",
              "key": "ctrl+t"
            },
            {
              "title": "Reformat code",
              "key": "opt+cmd+l"
            }
          ]
        },
        {
          "title": "Navigation",
          "shortcuts": [
            {
              "title": "Recent files",
              "key": "cmd+e"
            },
            {
              "title": "Open window in floating mode",
              "key": "shift+f4"
            }
          ]
        },
        {
          "title": "Version Control System",
          "shortcuts": [
            {
              "title": "Update project",
              "key": "cmd+t"
            },
            {
              "title": "Commit project",
              "key": "cmd+k"
            },
            {
              "title": "Push commits",
              "key": "shift+cmd+k"
            },
            {
              "title": "Push commits with force push",
              "key": "shift+cmd+k shift+opt+enter enter"
            },
            {
              "title": "Pull changes",
              "key": "shift+cmd+k"
            }
          ]
        }
      ]
    }
  ]
}
